company,description,archetype,industry,link
"Mendel.ai","Offers the Hypercube platform integrating LLMs with structured clinical ontologies for clinical data abstraction, OCR of medical records (Retina), PHI de-identification (Redact), clinical search, and trial matching.",Data,Healthcare,https://www.mendel.ai/
"Nayya","An AI-powered platform that helps employees navigate and optimize their health and wealth benefits. It provides personalized recommendations for health plans, automates medical claim audits, simplifies leave of absence processes, and integrates insights for retirement planning.",Customer,Healthcare,https://www.nayya.com/
"Eko Health","Develops FDA-cleared AI algorithms integrated into its digital stethoscopes (e.g., CORE 500™) for early detection of cardiac conditions like atrial fibrillation (AFib) and heart murmurs during routine physical exams.",Customer,Healthcare,https://www.ekohealth.com/
"CodaMetrix","Provides an AI-powered autonomous medical coding platform that automates the conversion of clinical documentation into accurate medical codes for billing and revenue cycle management, reducing manual coding by 60-70% and coding denials.",Employee,Healthcare,https://www.codametrix.com/
"Cherish Health","Develops intelligent radar-based sensor platforms (e.g., Cherish Serenity) that use AI for ambient health and safety monitoring, particularly for aging in place, detecting falls, and monitoring well-being without cameras or wearables that need constant interaction.",Data,Healthcare,https://www.cherishhealth.com/
"Intelligencia AI","Leverages AI to de-risk and enhance clinical development by providing probability of success (PTRS/PoS) assessments for drugs, identifying underlying risk drivers, and optimizing clinical trial design.",Data,Healthcare,https://www.intelligencia.ai/
"sikka.ai (Dental)","Offers an AI platform for dental practices (Sikka Prime®, Optimizer™) providing tools for patient insurance eligibility verification, payment processing options, real-time metrics tracking, and identifying areas for practice optimization.",Employee,Healthcare,https://sikka.ai/Dental
"Dyno Therapeutics","A genetic technologies company applying AI (frontier AI with high-throughput experimentation) to design and optimize AAV (Adeno-Associated Virus) capsids for improved in vivo gene delivery, partnering with major pharma companies like Roche and Sarepta.",Creative,Healthcare,https://www.dynotx.com/
"Proscia","Provides the Concentriq® enterprise pathology platform, an open digital system enabling AI in pathology. It supports building, accessing, and deploying AI solutions for precision medicine, including AI-based biomarkers and diagnostics.",Data,Healthcare,https://proscia.com/
"SafelyYou","Offers AI-powered fall detection and prevention solutions for senior living communities (SafelyYou Respond™). Uses AI-enabled sensors and video review to identify root causes of falls and improve resident safety, also providing remote wellness checks (Aware™) and care tracking (Clarity™).",Data,Healthcare,https://www.safely-you.com/
"SignalPET","Provides AI-powered veterinary radiology software that offers rapid X-ray interpretation assistance to veterinarians, aiming to improve diagnostic accuracy and efficiency in animal care.",Customer,Healthcare,https://www.signalpet.com/
"Sirona Medical","Building a radiology operating system (RadOS) designed to unify disparate radiology IT systems (PACS, RIS, AI) into a single, cloud-native platform, simplifying workflows and enabling better integration of AI diagnostic tools.",Employee,Healthcare,https://sironamedical.com/
"Regard (by Elion Health)","An AI clinical co-pilot that integrates with Electronic Health Records (EHRs) to analyze patient data, recommend diagnoses (acute and chronic), generate care plans, and automate clinical documentation, aiming to reduce cognitive load on clinicians.",Employee,Healthcare,https://elion.health/products/regard
"Pison Technology","Develops neural sensing technology using electroneurography (ENG) and AI to translate biosignals from the brain into machine-interpretable events. Applications include mental chronometry (reaction time), health monitoring (sleep analytics, impairment biomarkers), and gesture control, with research into neurological disorder detection (ALS, Parkinson's).",Data,Healthcare,https://pison.com/
"Pathos AI","A company focused on AI-driven drug development, particularly in oncology. Associated with clinical trials for drugs like Milademetan in combination with other therapies for specific cancer types.",Data,Healthcare,https://www.pathos.com/
"Alife Health","Provides an AI-powered ecosystem of products for IVF clinics designed to optimize fertility treatments. Applications include Stim Assist (optimizing ovarian stimulation), Embryo Assist (standardizing embryo grading), and Success Predictor.",Data,Healthcare,https://www.alifehealth.com/
"Subtle Medical","Develops AI-powered software solutions (SubtleHD™, SubtlePET™, SubtleGAD™, SubtleSYNTH™, SubtleALIGN™) to enhance medical imaging (MRI, PET) by improving image quality, enabling significantly faster scan times, and reducing the need for contrast agents or gadolinium.",Data,Healthcare,https://subtlemedical.com/
"Sorcero","Provides AI-powered solutions for the life sciences industry, including Medical Affairs Intelligence (Instant Insights Engine for answering complex medical questions) and AI-powered literature monitoring for rapidly detecting critical safety signals.",Data,Healthcare,https://www.sorcero.com/
"Openwater","Developing open-source medical imaging and therapeutic ultrasound technology. Open-Motion 3.0 uses near-infrared light and holographic detection for blood flow/oxygenation measurement. Open-LIFU 2.0 is a platform for low-intensity focused ultrasound therapy research.",Customer,Healthcare,https://www.openwater.cc/
"Plenful","An AI-powered workflow automation platform for pharmacy operations, addressing tasks such as prior authorization processing (aiming for 4x throughput increase), 340B claims auditing, and order/referral data entry.",Employee,Healthcare,https://www.plenful.com/
"ImpriMed","Offers an AI-driven personalized medicine service for veterinary oncology, specifically for dogs with lymphoma or leukemia. It tests live cancer cells against various chemo drugs and uses AI to predict treatment efficacy.",Data,Healthcare,https://www.imprimedicine.com/
"XpertDox","Provides XpertCoding, an AI-powered autonomous medical coding engine that uses NLP and big data analytics to code medical claims with high accuracy and speed, aiming to identify missing CPT codes and reduce manual coding tasks by over 90%.",Employee,Healthcare,https://www.xpertdox.com/
"AI Proteins","A company focused on re-imagining protein-based medicines by designing novel miniproteins from scratch using a proprietary platform that combines synthetic biology, robotics, automation, and AI. Advancing a pipeline in oncology and exploring partnerships in other areas.",Creative,Healthcare,https://aiproteins.bio/
"Deepcell","Develops the REM-I platform, which combines label-free imaging, deep learning, and gentle cell sorting to leverage single-cell morphology as a high-dimensional quantitative readout for research and diagnostics. Collaborates with NVIDIA for GenAI in single-cell research.",Data,Healthcare,https://deepcell.com/
"SimpleTherapy","A digital musculoskeletal (MSK) healthcare solution providing virtual care from prevention to surgical rehabilitation. It blends real-time AI with a clinical care team to deliver personalized MSK exercise therapy programs.",Customer,Healthcare,https://simpletherapy.com/
"CarePredict","Offers an AI-powered remote monitoring system for senior living, using the Tempo™ wearable and context beacons to detect activities (eating, bathing, sleeping) and predict health risks like falls (reduced by 69%) and UTIs, enabling early intervention.",Data,Healthcare,https://www.carepredict.com/
"Biovista","Utilizes its COSS™ AI platform for systematic drug repositioning, finding new therapeutic uses for existing drugs by generating robust Mechanism-of-Action rationales and evaluating opportunities based on IP and FTO potential.",Data,Healthcare,https://www.biovista.com/
"Eyebot","Provides 90-second AI-powered vision tests and eyewear prescriptions via self-serve kiosks, aiming to make vision care more accessible. Partners with eyewear brands like Zenni Optical.",Customer,Healthcare,https://www.eyebot.co/
"Ryght AI","A real-time generative AI healthcare technology company focused on the clinical research industry. Its platform automates tasks like site identification, feasibility and selection, budget negotiations, patient referrals, and trial compliance for research sites, sponsors, and CROs.",Employee,Healthcare,https://www.ryght.ai/
"Model Medicines","Employs the GALILEO™ AI Drug Discovery Platform, which uses multimodal data (3D protein structures, biochemical data) to generate 'constellations' and identify novel drug candidates from deep chemical space for novel biology.",Data,Healthcare,https://modelmedicines.com/
"Aizon","Provides an end-to-end SaaS GxP (Good Practice) solution for pharmaceutical manufacturing, using Big Data, IoT, and AI to turn paper-based decisions into data-driven, real-time optimizations for digitization, data unification, and AI industrialization.",Data,Healthcare,https://www.aizon.ai/
"NVIDIA BioNeMo","A generative AI platform for drug discovery, offering models for protein structure prediction (ESMFold), generative chemistry (MolMIM), and molecular docking prediction (DiffDock), enabling researchers to accelerate various stages of therapeutic development.",Creative,Healthcare,https://www.nvidia.com/en-us/clara/bionemo/
"Dartmouth College (Therabot)","Researchers developed Therabot, a generative AI-powered therapy chatbot, which in its first clinical trial demonstrated significant improvements in participants' mental health symptoms, showing potential for accessible mental health support.",Customer,Healthcare,https://home.dartmouth.edu/news/2025/03/first-therapy-chatbot-trial-yields-mental-health-benefits
"Tempus","A technology company advancing precision medicine through the practical application of artificial intelligence in healthcare. Its platform analyzes clinical and molecular data to personalize cancer care and other treatments.",Data,Healthcare,https://www.tempus.com/
"Honeywell (Field Process Knowledge System - PKS)","Deployed the Field Process Knowledge System (PKS), which uses generative AI to provide field technicians and operators with instant access to documents, procedures, and critical information on their devices, enhancing efficiency and safety in industrial settings.",Employee,Manufacturing,https://process.honeywell.com/us/en/solutions/industrial-ai-solutions
"Honeywell (TrackWise Digital)","Offers TrackWise Digital, an AI-enabled quality management solution that leverages natural language processing and machine learning for enhanced signal detection, operational efficiency, and employee productivity, particularly in life sciences manufacturing.",Data,Manufacturing,https://www.honeywell.com/us/en/products-services/software-and-apps/enterprise-performance-management/trackwise-digital
"AES Corporation (Maximo Robot)","Developed and deployed Maximo, an AI-powered robot that automates the heavy lifting and precise installation of solar panels. Maximo uses generative AI, computer vision, and advanced robotics to install panels faster, more safely, and at a lower cost than traditional methods.",Customer,Manufacturing,https://www.aes.com/maximo
"AES Corporation (Grid & Energy Management)","Applying AI for risk-based maintenance in utilities (e.g., vegetation management), anomaly and trend detection in renewables asset performance, and developing predictive analytics tools for renewable energy generation forecasting to support market decisions.",Data,Manufacturing,https://www.aes.com/solutions/advanced-energy-networks
"Enpal","Partnered with Google Cloud (and dida, a Google Cloud partner) to develop a custom AI solution that automates the solar panel quotation generation process, reducing the time taken from 120 minutes to just 15 minutes, thereby increasing sales efficiency.",Employee,Manufacturing,https://www.enpal.de/
"Siemens (Industrial Copilot - General)","Developing the Siemens Industrial Copilot, a suite of generative AI-powered assistants to enhance productivity across the industrial value chain, from design and planning to engineering, operations, and services. For example, assisting engineering teams in generating PLC code using natural language.",Employee,Manufacturing,https://press.siemens.com/global/en/pressrelease/siemens-expands-industrial-copilot-new-generative-ai-powered-maintenance-offering
"Siemens (Industrial Copilot for Maintenance)","Extending its Industrial Copilot offering with advanced capabilities for Senseye Predictive Maintenance. This GenAI-powered solution supports the entire maintenance cycle, from repair and prevention to prediction and optimization, aiming to reduce reactive maintenance time by an average of 25%.",Employee,Manufacturing,https://www.siemens.com/global/en/products/services/digital-enterprise-services/plant-data-services/senseye-predictive-maintenance.html
"Siemens (Teamcenter Digital Reality Viewer)","Integration of NVIDIA Omniverse into Teamcenter PLM software to create the Teamcenter Digital Reality Viewer, enabling high-performance, photorealistic, physics-based visualization and interaction with complex digital twins of products and manufacturing environments.",Creative,Manufacturing,https://blogs.sw.siemens.com/teamcenter/teamcenter-digital-reality-viewer-with-nvidia-omniverse/
"General Electric (GE Vernova - Digital Twin Technology)","Pioneer in digital twin technology, utilizing solutions like SmartSignal (AI/ML predictive analytics for asset twins in energy), Geo Network Management (Grid Digital Twins), and Proficy CSense (Process Digital Twins for manufacturing optimization).",Data,Manufacturing,https://www.gevernova.com/software/innovation/digital-twin-technology
"GE Vernova (CERius Emissions Management)","Offers CERius, an AI-powered carbon emissions management software designed to help energy industries measure, manage, and operationalize insights to reduce carbon emissions, improving GHG calculation accuracy using digital twin technology and machine learning.",Data,Manufacturing,https://www.gevernova.com/software/products/emission-data-management/cerius
"GE Vernova (GridBeats™)","A portfolio of software-defined automation solutions for grid digitalization, enhancing grid resilience and reliability with AI/ML-based automation, predictive maintenance (GridBeats™ APM), and improved visibility across the grid.",Data,Manufacturing,https://www.gevernova.com/grid-solutions/gridbeats
"GE Aerospace (AI-Driven Inspection)","Deployed an AI-enabled Blade Inspection Tool for narrowbody aircraft engines (CFM LEAP) and widebody engines (GEnx). The tool uses AI to guide technicians in reviewing turbine blade images, improving inspection accuracy and consistency, and cutting inspection times by half.",Employee,Manufacturing,https://www.geaerospace.com/news/press-releases/ge-aerospace-deploys-ai-driven-inspection-tool-maximize-narrowbody-engine-time-wing
"GE Aerospace (Generative Design & Additive Manufacturing)","Utilizing generative design and additive manufacturing (3D printing) for aerospace components, such as a one-meter-diameter turbine center frame casing made from nickel alloy 718, achieving 30% cost and weight reduction and consolidating over 150 parts into one.",Creative,Manufacturing,https://www.geaerospace.com/news/articles/manufacturing-product/turn-larger-lighter-additive-parts
"GE Aerospace (Supplier Collaboration & Lean Manufacturing)","Working with suppliers (e.g., a Pennsylvania-based airfoil component maker for LEAP engines) to implement its FLIGHT DECK lean operating model, leveraging data and process analysis (implicitly supported by AI tools for efficiency) to solve production bottlenecks and improve parts delivery.",Employee,Manufacturing,https://www.geaerospace.com/news/articles/how-ge-aerospace-lean-leader-worked-supplier-solve-baffling-problem
"GE Aerospace (Open Fan Engine Design Simulation)","Collaborating with Boeing, NASA, and Oak Ridge National Laboratory to use exascale supercomputing (Aurora and Frontier) to model and simulate the integration and aerodynamic performance of an Open Fan engine design with an airplane wing.",Customer,Manufacturing,https://www.geaerospace.com/news/press-releases/ge-aerospace-boeing-and-nasa-study-performance-installed-open-fan-engine-design
"Intel (Tiber Developer Cloud)","Provides the Tiber Developer Cloud, a platform offering access to Intel hardware (CPUs, GPUs, Gaudi AI accelerators) and software tools (oneAPI, optimized frameworks) for developers and enterprises to build, test, train, optimize, and deploy AI/ML workloads, including generative AI.",Code,Manufacturing,https://ai.cloud.intel.com/
"Intel (Gaudi AI Accelerators)","Produces Gaudi AI accelerators (Gaudi 2, Gaudi 3) specifically optimized for large-scale generative AI training and inference, offering competitive price/performance. Deployed by partners like IBM Cloud, Dell, and H3C for enterprise AI solutions.",Customer,Manufacturing,https://www.intel.com/content/www/us/en/products/details/processors/gaudi.html
"Intel (GenAI Use Case Enablement)","Intel's processors and AI chips (Xeon, Core Ultra, Gaudi) are foundational for various GenAI applications including Large Language Models (LLMs), autonomous vehicles, edge computing, robotics, High-Performance Computing (HPC), and client computing AI experiences.",Data,Manufacturing,https://www.intel.com/content/www/us/en/artificial-intelligence/overview.html
"Fortanix (Armet AI with Intel)","Armet AI platform, built on Intel Confidential Computing (SGX, TDX) and Intel Tiber Trust Authority, enables enterprises to create secure and compliant custom GenAI applications by protecting data in use within hardware-based trusted execution environments (TEEs).",Security,Manufacturing,https://www.fortanix.com/platform/confidential-ai
"AMD (ROCm Software Stack)","Provides the ROCm open software stack, including drivers, development tools, libraries (MIOpen, MIVisionX), and APIs, to enable GPU programming for AI and HPC workloads, supporting frameworks like PyTorch and TensorFlow for generative AI model development.",Code,Manufacturing,https://www.amd.com/en/products/software/rocm.html
"AMD (Instinct Accelerators)","Offers Instinct GPU accelerators (e.g., MI300X, MI325X) designed for data center AI workloads, including training and inference for Generative AI LLMs, video analytics, and recommendation engines, demonstrating competitive performance on models like Llama 2, Llama 3.1, and Stable Diffusion XL.",Customer,Manufacturing,https://www.amd.com/en/products/server-accelerators/instinct.html
"AMD (Ryzen AI)","Delivers Ryzen AI technology in its processors for laptops, desktops, and mobile workstations, enabling on-device AI capabilities that improve business productivity, collaboration, creativity, and security features.",Customer,Manufacturing,https://www.amd.com/en/technologies/ryzen-ai
"NVIDIA (Omniverse Platform)","An open platform for developing Universal Scene Description (OpenUSD)-based 3D workflows and applications, enabling the creation of photorealistic digital twins, synthetic data generation for AI training, virtual factory simulations, and collaborative design in industrial and robotic use cases.",Creative,Manufacturing,https://www.nvidia.com/en-us/omniverse/
"NVIDIA (Isaac for Healthcare & Robotics)","NVIDIA Isaac for Healthcare is a medical device simulation platform with pretrained models and physics-based simulations for developing autonomous imaging systems (e.g., with GE HealthCare) and robotics. Isaac Sim is used more broadly for robotics simulation.",Data,Manufacturing,https://developer.nvidia.com/isaac-robotics
"NVIDIA (NeMo Framework)","A scalable and cloud-native generative AI framework for researchers and developers working on Large Language Models (LLMs), Multimodal Models, and Speech AI (ASR, TTS), providing tools for data curation (NeMo Curator), customization (NeMo Customizer), evaluation (NeMo Evaluator), RAG (NeMo Retriever), and safety (NeMo Guardrails).",Code,Manufacturing,https://www.nvidia.com/en-us/ai-data-science/products/nemo/
"NVIDIA (Riva Speech AI)","An SDK for building fully customizable, real-time multilingual speech and translation AI applications. Used for virtual assistants, contact centers, transcription services, and creating custom voices for various enterprise applications.",Customer,Manufacturing,https://developer.nvidia.com/riva
"NVIDIA (DGX Cloud & AI Enterprise)","DGX Cloud provides a unified AI supercomputing platform on leading clouds for demanding AI workloads like LLM training and inference. NVIDIA AI Enterprise is a software suite optimizing AI development and deployment for enterprises.",Data,Manufacturing,https://www.nvidia.com/en-us/data-center/dgx-cloud/
"Qualcomm (AI Hub & Snapdragon Platforms)","Qualcomm AI Hub provides a library of pre-optimized AI models and tools for deploying AI (including generative AI for text, image, audio) efficiently on edge devices powered by Snapdragon and other Qualcomm platforms, enabling on-device inference for mobile, compute, automotive, and IoT.",Code,Manufacturing,https://aihub.qualcomm.com/
"Qualcomm (Snapdragon Ride & Automotive AI)","The Snapdragon Ride Platform and other automotive solutions leverage AI for advanced driver-assistance systems (ADAS), in-cabin monitoring, generative AI for simulated driving scenarios, and personalized in-car experiences.",Customer,Manufacturing,https://www.qualcomm.com/products/automotive
"Qualcomm (Cloud AI SDK & Accelerators)","Offers Cloud AI 100 accelerators and associated SDKs for high-performance, power-efficient inference in cloud data centers, supporting generative AI LLMs, NLP, and computer vision workloads.",Customer,Manufacturing,https://developer.qualcomm.com/software/cloud-ai-sdk
"Articul8 AI (Intel Spinoff)","An enterprise GenAI platform with products (A8 Essential, Enterprise, Expert) and tools (DataSculptr™, DataCraftr™, DataRel8r™) for building sophisticated, domain-specific AI applications using proprietary enterprise data, engineered for regulated industries.",Data,Manufacturing,https://articul8.ai/
"KUKA (with Empolis Buddy)","Global automation solutions provider using Empolis Buddy, a generative AI virtual assistant (built on AWS Bedrock), to provide customers and employees with quick access to product information, troubleshooting guides, and technical documentation from extensive manuals.",Customer,Manufacturing,https://www.kuka.com/en-de/company/press/news
"Hitachi","Applying generative AI within its Lumada IoT platform to provide predictive maintenance for industrial equipment, optimize manufacturing schedules, and generate insights from operational data across various industrial sectors.",Data,Manufacturing,https://www.hitachi.com/rev/index.html
"Amazon","Powered personalized product recommendations engine 'Your Amazon.com' using generative AI to analyze customer browsing history, purchase patterns, and preferences to generate highly targeted product suggestions across all platforms.",Customer,Retail,https://www.amazon.com/gp/yourstore
"Shopify","Launched Shopify Magic, an AI-powered suite of tools for merchants including automated product descriptions, blog posts, email campaigns, and image enhancement to help small businesses compete with larger retailers.",Customer,Retail,https://www.shopify.com/magic
"Walmart","Implemented AI-powered inventory optimization system that predicts demand patterns, automates restocking decisions, and generates supply chain insights to reduce waste and improve product availability across 10,500+ stores.",Employee,Retail,https://corporate.walmart.com/newsroom/innovation
"Target","Deployed generative AI for personalized marketing campaigns, creating customized email content, product recommendations, and promotional offers based on individual customer shopping behavior and seasonal trends.",Customer,Retail,https://corporate.target.com/news-features/article/2024/10/target-ai-guest-experience
"Sephora","Enhanced Virtual Artist app with generative AI to create personalized makeup looks, generate beauty tutorials, and provide AI-powered color matching recommendations based on skin tone analysis.",Customer,Retail,https://www.sephora.com/beauty/how-to-use-virtual-artist
"Home Depot","Launched AI-powered project assistant that generates step-by-step DIY guides, creates shopping lists for home improvement projects, and provides personalized tool recommendations based on project complexity.",Customer,Retail,https://www.homedepot.com/c/ai_assisted_shopping
"Best Buy","Implemented generative AI chatbot for technical support and product recommendations, capable of troubleshooting electronics issues, comparing products, and generating personalized tech setup guides.",Customer,Retail,https://www.bestbuy.com/site/customer-service/contact-us/pcmcat1511375025410.c
"Zara","Utilizing AI for fast fashion trend prediction and design generation, analyzing social media trends, runway shows, and customer preferences to create new clothing designs and optimize inventory distribution.",Creative,Retail,https://www.inditex.com/itxcomweb/en/sustainability/innovation
"Nike","Deployed Nike Fit technology with AI-powered size recommendations, and generative AI for creating personalized workout plans and custom shoe design suggestions through the Nike app ecosystem.",Customer,Retail,https://www.nike.com/help/a/nike-fit
