company,description,archetype,industry,link
"Verily Life Sciences (Alphabet)","Uses AI to analyze population health patterns and predict disease outbreaks using data from wearables, environmental sensors, and health records. Successfully predicted COVID-19 hotspots 2 weeks in advance.",Data,Healthcare,https://verily.com/solutions
"Insilico Medicine","Comprehensive AI platform for drug discovery, from target identification to lead optimization using generative chemistry. Has advanced 30+ novel compounds to preclinical trials using AI-designed molecules.",Creative,Healthcare,https://insilico.com
"Butterfly Network Inc.","Handheld ultrasound devices with integrated AI for automated image interpretation and diagnostic assistance. The AI provides real-time guidance and can detect abnormalities across 20+ anatomical structures.",Customer,Healthcare,https://butterflynetwork.com
"Standard Bots Inc.","AI-powered collaborative robots with built-in 3D vision and no-code programming interface for manufacturing automation. Reduces robot programming time from weeks to hours with intuitive drag-and-drop interfaces.",Employee,Manufacturing,https://standardbots.com
"Paige Inc.","AI system for analyzing pathology slides to assist pathologists in cancer diagnosis with superhuman accuracy. FDA-approved platform reduces diagnostic errors by 85% and speeds up analysis by 50%.",Employee,Healthcare,https://paige.ai
"Atomwise Inc.","AI platform for virtual screening of millions of compounds to identify potential drug candidates for various diseases. Uses convolutional neural networks to predict molecular activity with 10x higher success rates.",Data,Healthcare,https://atomwise.com
"Recursion Pharmaceuticals","AI analysis of cellular images to identify disease mechanisms and potential therapeutic interventions. Generates and analyzes over 2 million cellular images weekly to discover new drug targets.",Data,Healthcare,https://recursion.com
"Ginkgo Bioworks Inc.","AI-driven design and optimization of microorganisms for pharmaceutical and industrial applications. Automated foundries produce thousands of engineered organisms monthly for drug manufacturing.",Creative,Healthcare,https://ginkgobioworks.com
"Twist Bioscience Corp.","AI-optimized DNA synthesis platform for creating custom genetic sequences for research and therapeutics. Silicon-based synthesis enables production of 1 million oligos on a single chip.",Creative,Healthcare,https://twistbioscience.com
"BioNTech SE","AI-designed personalized cancer vaccines based on individual tumor neoantigen profiles. Uses machine learning to identify optimal neoantigen combinations for maximum immune response activation.",Customer,Healthcare,https://biontech.de/science/platforms/individualized-neoantigen-specific-immunotherapy
"x Genomics Inc.","AI tools for analyzing single-cell genomics data to understand cellular heterogeneity and disease mechanisms. Platform enables analysis of millions of individual cells simultaneously.",Data,Healthcare,https://10xgenomics.com
"Freenome Inc.","AI platform combining genomics, proteomics, and other data types for early cancer detection from blood tests. Multimodal approach achieves 85% sensitivity for early-stage colorectal cancer detection.",Data,Healthcare,https://freenome.com
"Boston Dynamics Inc.","Humanoid robots with advanced AI locomotion for complex manufacturing tasks in automotive and aerospace industries. Atlas robots perform quality inspections and material handling in hazardous environments.",Employee,Manufacturing,https://bostondynamics.com/atlas
"Veracyte Inc.","AI-powered genomic classifiers for cancer diagnosis and treatment selection from tissue samples. Molecular tests help over 75,000 patients annually make informed treatment decisions.",Customer,Healthcare,https://veracyte.com
"KUKA AG","AI-ready robotic operating system enabling autonomous decision-making in manufacturing environments. The platform allows robots to learn from experience and adapt to new tasks without reprogramming.",Employee,Manufacturing,https://kuka.com/en-us/future-production/industrie-4-0
"Universal Robots A/S","Collaborative robots with AI-powered force control and real-time adaptation to manufacturing variations. Built-in AI enables robots to automatically adjust to part variations and surface irregularities.",Employee,Manufacturing,https://universal-robots.com
"ABB Ltd.","AI-enhanced collaborative robots for precision assembly with machine learning and computer vision capabilities. YuMi robots perform delicate tasks like smartphone assembly with human-level dexterity.",Employee,Manufacturing,https://new.abb.com/products/robotics
"Chainlink Labs","AI-powered oracle network providing real-world data to smart contracts with machine learning validation. Chainlink Functions enables AI computations directly within blockchain applications, supporting 1000+ DeFi protocols.",Data,Finance,https://chain.link
"Aave Companies","AI-driven risk assessment and liquidation management for decentralized lending protocols. Machine learning models monitor collateral health and predict liquidation risks across 15+ blockchain networks.",Data,Finance,https://aave.com
"MakerDAO","AI analysis of governance proposals and voting patterns to optimize decentralized decision-making processes. Machine learning models predict proposal success rates and suggest improvements.",Employee,Finance,https://makerdao.com
"Compound Labs Inc.","AI-powered algorithmic interest rate models that automatically adjust lending and borrowing rates based on supply and demand dynamics. Serves over $10 billion in locked value.",Data,Finance,https://compound.finance
"Yearn Finance","Autonomous yield farming strategies powered by AI algorithms that automatically move funds between DeFi protocols to maximize returns. Manages over $500 million in automated strategies.",Data,Finance,https://yearn.fi
"inch Labs","AI-powered decentralized exchange aggregator that finds optimal trading routes across multiple DEXs. Pathfinder algorithm reduces trading costs by up to 90% through intelligent route optimization.",Data,Finance,https://1inch.io
"Uniswap Labs","Machine learning algorithms for optimizing automated market maker (AMM) pricing and reducing impermanent loss for liquidity providers. AI models predict optimal fee structures and pool parameters.",Data,Finance,https://uniswap.org
"Euler Labs Ltd.","Permissionless lending protocol with AI-driven risk assessment that automatically lists new assets and sets risk parameters based on on-chain liquidity and volatility analysis.",Data,Finance,https://euler.finance
"Maple Finance","Decentralized credit protocol using AI for institutional borrower assessment and automated loan origination. Machine learning models evaluate creditworthiness without traditional KYC processes.",Data,Finance,https://maple.finance
"Offchain Labs Inc.","Layer 2 solution with AI-powered fraud proof generation and validation for optimistic rollups. Machine learning models detect invalid state transitions and generate cryptographic proofs.",Security,Finance,https://arbitrum.io
"Synthetix Ltd.","Generative AI for creating and managing synthetic financial instruments on blockchain networks. AI models generate price feeds and manage collateralization ratios for synthetic assets.",Creative,Finance,https://synthetix.io
"The Graph Foundation","Decentralized protocol for indexing and querying blockchain data using AI-powered subgraphs. Machine learning algorithms optimize query performance and data availability across Web3 applications.",Data,Finance,https://thegraph.com
"Polygon Labs","Multi-chain scaling platform using AI for validator selection, consensus optimization, and cross-chain bridge security. AI models optimize network performance across multiple blockchain networks.",Data,Finance,https://polygon.technology
"Waymo LLC (Alphabet)","Fully autonomous ride-hailing service using advanced AI for perception, prediction, and path planning. Waymo Driver has completed over 20 million autonomous miles with superhuman safety performance.",Customer,Manufacturing,https://waymo.com
"Convex Finance","AI-powered yield optimization platform that automatically compounds Curve Finance rewards and maximizes returns through intelligent strategy allocation.",Data,Finance,https://convexfinance.com
"Ribbon Finance","AI-powered structured products and options strategies that automatically execute covered calls and protective puts to generate yield from crypto assets.",Data,Finance,https://ribbon.finance
"Motional Inc.","Joint venture developing Level 4 autonomous driving technology using AI for safe navigation in complex urban environments. Motional vehicles use multimodal sensors and deep learning for perception.",Data,Manufacturing,https://motional.com
"Optimism Collective","AI-optimized layer 2 scaling solution that uses machine learning to predict and optimize transaction batching and state compression for Ethereum scaling.",Employee,Finance,https://optimism.io
"Curve Labs","AI-optimized automated market maker specifically designed for stablecoin trading with minimal slippage. Machine learning models predict and prevent depeg events across stablecoin pools.",Data,Finance,https://curve.fi
"Aurora Innovation Inc.","Self-driving technology for long-haul trucking using AI for highway navigation and freight optimization. Aurora Driver enables fully autonomous goods movement between distribution centers.",Employee,Manufacturing,https://aurora.tech
"Livepeer Inc.","Decentralized video streaming network with AI-powered transcoding and content optimization. AI models provide real-time video enhancement and compression for live streaming applications.",Creative,Finance,https://livepeer.org
"WeRide Corp.","AI-powered autonomous driving technology for multiple vehicle types including passenger cars, buses, and delivery vehicles. Operates robotaxi and robobus services across multiple cities.",Customer,Manufacturing,https://weride.ai
"Pony.ai Inc.","AI-powered autonomous driving technology for robotaxi and ride-hailing services. Operates commercial robotaxi services in China and California with over 10 million test miles completed.",Customer,Manufacturing,https://pony.ai
"Mobileye Global Inc. (Intel)","AI-powered advanced driver assistance systems (ADAS) and autonomous driving technology using computer vision and machine learning. EyeQ chips power driver assistance in 130+ vehicle models worldwide.",Customer,Manufacturing,https://mobileye.com
"Zoox Inc. (Amazon)","Fully autonomous, purpose-built vehicles for ride-hailing using AI for bidirectional driving and urban navigation. Vehicle design optimized for autonomous operation without human controls.",Customer,Manufacturing,https://zoox.com
"TomTom N.V.","AI-enhanced navigation and mapping services for autonomous vehicles with real-time traffic optimization and route planning. TomTom Maps platform serves 800+ million users globally.",Customer,Manufacturing,https://tomtom.com
"HERE Technologies","AI-powered location platform providing real-time mapping and location intelligence for autonomous vehicles and smart cities. HERE platform processes location data from 200+ million connected vehicles.",Data,Manufacturing,https://here.com
"Cruise LLC (General Motors)","AI-powered autonomous vehicle platform for urban mobility with real-time fleet management and optimization. Operates commercial robotaxi service in San Francisco with 24/7 operations.",Customer,Manufacturing,https://getcruise.com
"May Mobility Inc.","AI-powered autonomous shuttle services for first and last-mile transportation in urban areas. Multi-Policy Decision Making (MPDM) technology enables safe operation in complex traffic scenarios.",Customer,Manufacturing,https://maymobility.com
"dYdX Trading Inc.","Decentralized derivatives exchange with AI-powered market making and liquidation engines. Advanced algorithms provide deep liquidity and efficient price discovery for perpetual contracts.",Data,Finance,https://dydx.exchange
"Aptiv PLC","AI-powered vehicle architecture and automated driving technology for next-generation mobility solutions. Smart Vehicle Architecture enables over-the-air updates and continuous AI improvement.",Employee,Manufacturing,https://aptiv.com
"Nuro Inc.","AI-powered autonomous delivery vehicles designed specifically for goods transportation. R2 vehicles operate unmanned delivery services for groceries and packages in suburban areas.",Customer,Manufacturing,https://nuro.ai
"Baidu Inc.","Open-source autonomous driving platform using AI for perception, prediction, and planning. Apollo platform powers robotaxi services and has partnered with 200+ automotive companies.",Employee,Manufacturing,https://apollo.auto
"State Farm (Claims AI)","Автоматизация обработки страховых случаев с помощью GenAI, включая анализ документов и оценку ущерба по фотографиям.",Employee,Finance,https://statefarm.com
"Lemonade (AI Claims)","Comprehensive AI usage от AI Maya для onboarding до AI Jim для claims processing, стремясь к скорости и эффективности.",Customer,Finance,https://lemonade.com
"Swiss Re (Reinsurance AI)","AI для complex risk modeling, анализа large-scale catastrophe data и generating insights для underwriting decisions.",Data,Finance,https://swissre.com
"Zurich Insurance (AI Interactions)","Virtual assistants для customer interaction, automated claims handling и insights generation from global risk data.",Customer,Finance,https://zurich.com
"Minecraft (AI Integration)","AI-enhanced gameplay features, включая intelligent tutorials и adaptive game mechanics.",Customer,Media,https://minecraft.net
"AXA (AI Transformation)","Empowering 140,000+ employees с secure AI capabilities от Mistral AI для text generation и document analysis.",Employee,Finance,https://axa.com
"Xbox (Smart Delivery)","AI-optimized game delivery, intelligent storage management и personalized gaming recommendations.",Customer,Media,https://xbox.com
"Orange (AI Assistant)","AI-powered customer service assistant и network optimization solutions для European markets.",Customer,Other,https://orange.com
"PlayStation (AI Gaming)","AI-enhanced gaming experiences, predictive loading и personalized game suggestions в PlayStation ecosystem.",Customer,Media,https://playstation.com
"USAA (Member AI)","AI-powered financial guidance для military families, automated insurance claims processing и personalized member support.",Customer,Finance,https://usaa.com
"Planet Labs (Earth Monitoring)","AI analysis сателлитных данных для environmental monitoring, deforestation tracking и climate impact assessment.",Data,Other,https://planet.com
"CarbonChain (Supply Chain Carbon)","AI для tracking carbon emissions across complex supply chains и automated sustainability reporting.",Data,Other,https://carbonchain.com
"Rockwell Automation Inc.","AI-enabled manufacturing execution system for real-time production optimization and quality control. Platform integrates with existing automation systems to provide predictive insights and autonomous adjustments.",Employee,Manufacturing,https://rockwellautomation.com/en-us/products/software/factorytalk.html
"M Co.","Computer vision and AI systems for automated quality inspection in manufacturing processes. AI-powered cameras detect defects 10x faster than human inspectors with 99.9% accuracy.",Employee,Manufacturing,https://3m.com/3M/en_US/industrial-manufacturing-us
"Munich Re (Climate Risk AI)","Advanced analytics для assessing climate change risks, развития new insurance products и automated contract analysis.",Creative,Finance,https://munichre.com
"IBM (Environmental Intelligence)","AI-powered weather forecasting, climate risk analysis и environmental monitoring solutions для enterprises и governments.",Data,Other,https://ibm.com/weather
"Salesforce (Sustainability Cloud)","AI-enhanced carbon accounting, emissions tracking и sustainability reporting для enterprise customers.",Employee,Other,https://salesforce.com/sustainability
"Tempus Labs","AI platform analyzing molecular and clinical data to recommend optimal cancer treatments for individual patients. Processes over 1 million patient records to identify treatment patterns and predict therapeutic responses.",Customer,Healthcare,https://tempus.com/oncology
"andMe Inc.","Utilizes AI algorithms to calculate personalized disease risk scores from genetic data, providing actionable health insights to over 12 million customers. The system combines genetic variants with lifestyle factors for comprehensive risk assessment.",Customer,Healthcare,https://23andme.com/health
"AT&T (Customer AI)","GenAI для automated customer service, personalized plan recommendations и proactive issue resolution.",Customer,Other,https://att.com
"T-Mobile (5G Optimization)","AI-driven 5G network optimization, dynamic spectrum allocation и predictive capacity planning.",Data,Other,https://t-mobile.com
"Ericsson (Network Intelligence)","AI-powered network management solutions для telecom operators, включая automated fault detection.",Employee,Other,https://ericsson.com
"Huawei (Intelligent Networks)","AI-powered network solutions, включая intelligent O&M и automated network optimization.",Employee,Other,https://huawei.com
"Allstate (Personalized Policies)","AI для персонализации страховых полисов, automated policy generation и virtual assistant для customer inquiries.",Customer,Finance,https://allstate.com
"Ric (Parametric Insurance)","AI и catastrophe modeling для разработки parametric insurance coverage для specific events like rainfall и floods.",Data,Finance,https://ric.insure
"Microsoft (Carbon Negative)","AI-powered carbon accounting, renewable energy optimization и sustainability analytics для достижения carbon negative goals к 2030.",Data,Other,https://microsoft.com/sustainability
"Tesla (Energy Ecosystem)","AI integration across solar panels, energy storage и electric vehicles для optimized renewable energy ecosystem.",Data,Other,https://tesla.com/energy
"Moderna Inc.","Employs generative AI to design personalized mRNA therapeutics for cancer treatment, generating custom mRNA sequences based on individual tumor genetics and immune profiles. The system analyzes patient-specific genomic data to create tailored immunotherapies with 40% higher efficacy rates.",Creative,Healthcare,https://moderna.com/platform/mrna-medicines
"Roche Genentech","Applies machine learning algorithms to identify novel biomarkers from integrated multi-omics datasets (genomics, proteomics, metabolomics), accelerating precision medicine development. The platform has identified 150+ new biomarkers for various diseases.",Data,Healthcare,https://gene.com/scientists/our-science/personalized-healthcare
"Illumina Inc.","AI-powered platform for interpreting complex genomic variants and predicting disease risk from whole genome sequencing data. Uses deep learning to classify variants with 98.5% accuracy, significantly outperforming traditional methods.",Customer,Healthcare,https://illumina.com/products/by-type/informatics-products/dragen-bio-it-platform.html
"Foundation Medicine (Roche)","Generative AI for comprehensive genomic profiling of tumors to identify targeted therapy options. The system analyzes 324 genes across all solid tumors to guide treatment decisions for oncologists.",Data,Healthcare,https://foundationmedicine.com/genomic-testing
"Guardant Health Inc.","AI-powered analysis of circulating tumor DNA (ctDNA) in blood samples for early cancer detection and monitoring treatment response. The platform can detect minimal residual disease with 95% sensitivity.",Data,Healthcare,https://guardanthealth.com/guardant360
"PathAI Inc.","Machine learning platform for digital pathology that improves diagnostic accuracy and speeds up pathological analysis. Used by 200+ laboratories worldwide for cancer research and drug development.",Employee,Healthcare,https://pathai.com
"FANUC Corp.","Machine learning algorithms for predictive maintenance and optimization of CNC machining operations. AI Field system learns from machine behavior to prevent unplanned downtime and optimize cutting parameters.",Employee,Manufacturing,https://fanuc.com/us/en/products/cnc.html
"Siemens AG","AI-powered digital twin technology for optimizing manufacturing processes and predictive maintenance. Digital Factory platform reduces time-to-market by 30% through virtual commissioning and optimization.",Employee,Manufacturing,https://siemens.com/global/en/products/automation/systems/industrial/digital-factory.html
"General Electric Co.","Industrial IoT platform with AI analytics for equipment optimization and predictive maintenance across manufacturing facilities. Predix platform manages over 1 million industrial assets globally.",Data,Manufacturing,https://ge.com/digital
"Honeywell International Inc.","AI-powered industrial software suite for process optimization, safety management, and energy efficiency in manufacturing plants. Forge platform connects 40+ million devices across industrial facilities.",Employee,Manufacturing,https://honeywell.com/us/en/products-and-solutions/advanced-software-applications
"Schneider Electric SE","AI-integrated automation platform for energy management and industrial process optimization. EcoStruxure platform manages energy efficiency across 20,000+ sites worldwide using AI-powered analytics.",Employee,Manufacturing,https://schneider-electric.com/en/work/solutions/system/s1/ecostruxure
"Applied Materials Inc.","AI-powered process control and optimization for semiconductor manufacturing equipment. Machine learning algorithms optimize film deposition and etching processes for higher yields and reduced waste.",Employee,Manufacturing,https://appliedmaterials.com
"Caterpillar Inc.","AI-powered autonomous vehicles and equipment for mining operations with remote monitoring capabilities. Command for Hauling system operates 300+ autonomous trucks in mining sites worldwide.",Employee,Manufacturing,https://caterpillar.com/en/solutions/autonomous.html
"Deere & Co.","AI-powered autonomous tractors and implements for precision farming and crop optimization. See & Spray technology uses computer vision to apply herbicides only where needed, reducing chemical usage by 90%.",Employee,Manufacturing,https://deere.com/en/technology-products/precision-ag-technology
"Tesla Inc.","AI-optimized production systems for electric vehicle manufacturing with predictive quality control. Neural networks predict and prevent quality issues before they occur on the assembly line.",Employee,Manufacturing,https://tesla.com/careers/manufacturing
"BMW AG","AI-powered factory layout optimization and production line planning for automotive manufacturing. Digital twin technology enables virtual factory commissioning before physical construction.",Employee,Manufacturing,https://bmwgroup.com/en/innovation/company/industry-4-0.html
"Ford Motor Co.","Intelligent manufacturing systems with AI for quality control and process optimization in vehicle assembly. Cobots work alongside humans in Ford's advanced manufacturing facilities.",Employee,Manufacturing,https://ford.com/about/innovation-and-technology/manufacturing
"General Motors Co.","AI-integrated electric vehicle battery manufacturing with predictive analytics and automation. Ultium Cells plants use AI for quality control and process optimization in battery production.",Employee,Manufacturing,https://gm.com/electric-vehicles/ultium-platform
"Intel Corp.","AI-powered process control and yield optimization for advanced semiconductor fabrication facilities. Machine learning algorithms optimize manufacturing parameters across 20+ fabrication steps.",Employee,Manufacturing,https://intel.com/content/www/us/en/manufacturing
"Balancer Labs","Self-balancing portfolio management using AI to maintain optimal asset weightings in liquidity pools. Smart pools automatically rebalance based on market conditions and user-defined parameters.",Data,Finance,https://balancer.fi
"AutoX Inc.","Fully driverless robotaxi service using AI for urban navigation without safety drivers. AutoX Gen5 system uses 50+ sensors and edge computing for real-time decision making.",Customer,Manufacturing,https://autox.ai
"Optimus Ride Inc.","AI-powered autonomous vehicle systems for geofenced environments including business parks, airports, and planned communities. Focus on Level 4 autonomy in controlled environments.",Customer,Manufacturing,https://optimusride.com
