company,description,archetype,industry,link
"Volkswagen (myVW App & IDA)","Multimodal virtual assistant integrated into the myVW app, leveraging Google's Gemini models to provide instant explanations for dashboard indicators. The IDA voice assistant incorporates ChatGPT for advanced natural language understanding in navigation, infotainment control, and answering general knowledge queries within the vehicle.",Customer,Manufacturing,https://www.vw.com/en/owners-and-services/connectivity-and-apps/myvw-app.html
"Uber Technologies","Employs AI-powered predictive ordering systems for its Uber Eats platform. Internally, GenAI is used for large-scale data annotation, comprehensive product testing across various scenarios, and content localization for over 100 languages to support its global operations.",Customer,Manufacturing,https://www.uber.com/us/en/scaled-solutions/generative-ai/
"Uber (TextSense)","Deployed TextSense, a GenAI-powered invoice processing system, significantly reducing manual effort by a factor of two, cutting invoice handling time by 70%, and achieving 25-30% cost savings while improving data accuracy to 90% for global financial operations.",Employee,Manufacturing,https://www.uber.com/newsroom/
"Uber (Internal Operations)","Utilizes AI tools to enhance internal efficiencies and productivity by providing automated conversation summaries for support staff interactions and streamlining investigative processes, leading to faster resolution times and improved service outcomes. Also uses AI for dynamic fare adjustments and real-time inventory management.",Employee,Manufacturing,https://www.uber.com/blog/engineering/
"Mercedes-Benz","Integration of GenAI into the MBUX (Mercedes-Benz User Experience) infotainment system to create a highly personalized in-car interface, offering proactive suggestions, learning driver preferences, and adapting system behavior over time.",Customer,Manufacturing,https://media.mercedes-benz.com/
"General Motors (OnStar)","Powering the OnStar Interactive Virtual Assistant with Google Cloud's Vertex AI Conversation platform to provide enhanced voice-activated services, emergency assistance, and in-vehicle support for GM vehicle owners.",Customer,Manufacturing,https://www.onstar.com/us/en/services/
"General Motors (Design)","Partnered with Autodesk to utilize generative design AI for optimizing vehicle components, exemplified by the redesign of a seatbelt bracket which resulted in a single-part design that is 40% lighter and 20% stronger than the original assembly.",Creative,Manufacturing,https://www.autodesk.com/customer-stories/general-motors
"Ford Motor Company (Internal LLM)","Beta-testing a proprietary Large Language Model (LLM) accessible to employees via a secure portal. This internal GenAI tool assists with drafting internal communications, generating marketing copy, and aiding in software development tasks, aiming to free up employee time for more strategic work.",Employee,Manufacturing,https://corporate.ford.com/
"Ford Motor Company (Ethical AI)","Development and implementation of comprehensive AI Ethics Principles based on seven key pillars (Trust, Social Responsibility, Safety, Fairness, Transparency, Privacy, Oversight, Best Practice) to guide the responsible use of AI across all company operations and product development.",Employee,Manufacturing,https://corporate.ford.com/microsites/ford-trends-2024/the-trust-algorithm.html
"BMW (Manufacturing)","Leveraging AI and machine vision in its manufacturing plants (e.g., Landshut) for the production of electric vehicle (EV) components, including battery assembly and electric engine housing, to enhance precision and quality control.",Employee,Manufacturing,https://www.bmwgroup-werke.com/munich/en/innovation/production-of-the-future.html
"Citi","Deployed AI coding tools to 30,000 developers to accelerate software development. Rolled out 'Stylus' document intelligence and 'Assist' virtual assistant to 143,000 employees for enhanced productivity and information access, leveraging Google Cloud for AI and analytics.",Code,Finance,https://www.citigroup.com/global/news/press-room
"Freenome","Developing blood tests for early cancer detection using a multiomics platform combined with AI and machine learning to identify signatures of colorectal and lung cancer from a standard blood draw.",Data,Healthcare,https://www.freenome.com/
"Mayo Clinic (Clinical Data Research)","Leveraging Google Cloud's Vertex AI Search and other AI tools to enable researchers to explore and analyze over 50 petabytes of de-identified clinical data, accelerating medical research and discovery.",Data,Healthcare,https://www.mayoclinic.org/research/artificial-intelligence
"Samsung (Galaxy AI)","Embedded Google's Gemini AI into the Galaxy S24 series smartphones to offer a suite of AI-driven features, including on-device text summarization, advanced image editing capabilities (Generative Edit), Live Translate for calls, Note Assist for organizing notes, and Browsing Assist for webpage summaries.",Customer,Manufacturing,https://www.samsung.com/global/galaxy/galaxy-ai/
"Trimble","Utilizes Gemini for Google Workspace to enhance engineering productivity and automate document generation for its software and hardware solutions in the construction, agriculture, and geospatial industries.",Employee,Manufacturing,https://construction.trimble.com/en/solutions/artificial-intelligence
"Best Buy","Introducing a generative AI-powered virtual assistant on BestBuy.com and the mobile app to help customers troubleshoot product issues, manage orders and subscriptions. Also deploying AI tools for customer care agents to provide real-time conversation analysis and sentiment detection.",Customer,Retail,https://corporate.bestbuy.com/best-buy-and-google-cloud-partner-to-bring-generative-ai-to-customers-and-employees/
"Salesforce (Einstein GPT)","Integrates generative AI into its CRM platform to automate tasks and create personalized content. It can automatically generate emails for salespeople, create knowledge articles from past case notes, and produce personalized content for marketing campaigns.",Creative,Sales,https://www.salesforce.com/products/einstein/
"LegalMation","Automates the drafting of initial responses to lawsuits and discovery requests, reducing drafting time by an estimated 80%.",Employee,Legal,https://www.legalmation.com/
"Shoosmiths (Cia)","An AI-powered contract review service named 'Cia' that can analyze a contract in minutes, resulting in up to an 80% cost saving on external legal fees per contract.",Employee,Legal,https://www.shoosmiths.com/
"Everlaw","AI-powered e-discovery platform used by law firms to sift through massive volumes of data in litigation cases, identify key documents, summarize information, and draft case narratives.",Data,Legal,https://www.everlaw.com/
"T-Mobile (with Textio)","Implemented an AI-based solution from Textio to ensure its recruitment messaging is inclusive, creating job posts and recruiting emails with language that is welcoming to all candidates to attract a more diverse talent pool.",Creative,HR,https://textio.com/
"Mastercard (with Phenom)","Utilized Phenom's AI-driven talent experience platform to streamline the interview scheduling process, leading to an 85% increase in scheduling efficiency and expanding their candidate database by 900%.",Employee,HR,https://www.phenom.com/
"McDonald's (McHire)","Implemented an AI assistant named Olivia to streamline recruitment tasks, resulting in a 65% reduction in time-to-hire and allowing managers to dedicate more time to customer service.",Employee,HR,https://www.paradox.ai/
"IBM","Utilizes AI-driven platforms to create personalized learning paths for its workforce based on an employee's role and career aspirations, and to facilitate mentorship programs.",Employee,HR,https://www.ibm.com/artificial-intelligence
"Khan Academy (Khanmigo)","A GPT-4 powered tutor and teaching assistant that guides students through problems step-by-step to encourage critical thinking.",Customer,Education,https://www.khanacademy.org/khan-labs
"Duolingo (Duolingo Max)","Uses GPT-4 to create conversational practice scenarios and explain learners' mistakes in a natural way for language learning.",Customer,Education,https://www.duolingo.com/max
"University of Leeds","Encouraged Advertising and Design master's program students to use generative AI for ideation and to create images for their submissions, focusing on the communication of ideas rather than technical illustration skills.",Creative,Education,https://www.leeds.ac.uk/
"Aberystwyth University","Conducted a classroom evaluation of an AI-generated summary of a scientific concept to help students become more aware of the limitations of AI-generated content and foster a discussion about the responsible use of these tools.",Data,Education,https://www.aber.ac.uk/
"JLL (JLL GPT™)","Developed its own generative AI platform, JLL GPT™, trained on JLL's extensive internal data, to provide its global workforce with data-driven insights for planning advice and investment opportunity identification.",Data,RealEstate,https://www.jll.com/
"Redfin (Ask Redfin)","Integrated a generative AI-powered virtual assistant, 'Ask Redfin,' into its platform to answer homebuyer questions about listings, driving high user engagement and generating leads.",Customer,RealEstate,https://www.redfin.com/
"Compass (Likely to Sell)","The 'Likely to Sell' AI tool predicts which contacts in an agent's network are most likely to list their homes for sale, generating over $150 million in incremental revenue in 2021.",Data,RealEstate,https://www.compass.com/
"AppFolio (Realm-X)","Integrated generative AI into its property management platform with features like Realm-X Messages and Realm-X Assistant, saving property managers an average of 11.9 hours per week on communication-related tasks.",Employee,RealEstate,https://www.appfolio.com/
"Runway ML","Generative AI tools that empower film editors to perform complex tasks like rotoscoping, object removal, and background generation with significantly greater speed and accuracy, slashing manual editing time by an estimated 40% in one documentary project.",Creative,Media,https://runwayml.com/
"Niantic (Peridot)","Used a generative AI model to give its virtual creatures, called 'Dots,' a wide range of actions and behaviors that evolve as the pet 'learns' and grows, allowing for unique and unpredictable interactions.",Creative,Media,https://peridot.nianticlabs.com/
"NetEase (Ni Shuihan)","In the game 'Ni Shuihan,' generative AI is used to create more realistic and interactive non-player characters (NPCs) who can engage in more natural conversations with players.",Creative,Media,https://www.neteasegames.com/
"AIVA","AIVA (Artificial Intelligence Virtual Artist) is a virtual composer that creates original classical music for films, commercials, and games. It was the first virtual composer to be recognized by a music rights organization.",Creative,Media,https://www.aiva.ai/
"Amazon (Rufus)","A virtual assistant named Rufus, trained on Amazon's product catalog and customer reviews, to answer customer questions, compare products, and provide personalized recommendations.",Customer,Retail,https://www.aboutamazon.com/news/retail/rufus-amazon-generative-ai-shopping-assistant
"Stitch Fix","Uses a generative AI-powered tool called the Outfit Creation Model to generate personalized outfit suggestions based on available inventory and a customer's style preferences and purchase history.",Creative,Retail,https://www.stitchfix.com/
"Sephora (Virtual Artist)","The 'Virtual Artist' app uses facial recognition and generative AI to let customers try on makeup products digitally.",Customer,Retail,https://www.sephora.com/
"IKEA (Place)","The 'Place' app allows customers to visualize how furniture will look and fit in their own homes using augmented reality and AI, which has been shown to reduce return rates.",Customer,Retail,https://www.ikea.com/
"Carrefour (Hopla)","A ChatGPT-based intelligent assistant called Hopla to answer customer queries about products, availability, and store policies.",Customer,Retail,https://www.carrefour.com/
"BMW (In-Car AI Assistant - China)","Partnership with Alibaba to integrate the Tongyi AI foundational model into BMW's Neue Klasse vehicles produced in China, creating a custom AI-powered personal assistant for the local market, expected by 2026.",Customer,Manufacturing,https://www.press.bmwgroup.com/china/
"Tesla","Employing generative AI to create synthetic data and simulate complex edge-case scenarios for training and enhancing its Full Self-Driving (FSD) software, aiming to improve system robustness and accelerate development.",Data,Manufacturing,https://www.tesla.com/AI
"Defense Logistics Agency (DLA)","Implementing AI for demand planning and supply chain risk management, using over 55 models. Developing customized chatbot applications and virtual agents for acquisition business systems to improve efficiency.",Data,Manufacturing,https://www.dla.mil/About-DLA/News/News-Article-View/Article/4122004/
"Defense Logistics Agency (DLA - Fraud Detection)","Using an AI tool to automate the identification of vendors that could potentially supply counterfeit or overpriced items by analyzing supplier behaviors, past performance, and fraudulent activity patterns.",Security,Manufacturing,https://www.dla.mil/About-DLA/News/
"Rivian","Using Google Workspace with Gemini for improving employee productivity, including document summarization and internal communication drafting.",Employee,Manufacturing,https://rivian.com/newsroom
"Nuro","Designing and operating autonomous vehicles for local goods delivery, leveraging generative AI for scenario generation in simulations and for optimizing the design of its custom-built delivery robots.",Data,Manufacturing,https://www.nuro.ai/
"Trimble (Logistics)","Provides solutions for transportation and logistics, using generative AI for optimizing fleet routing, predictive asset maintenance, and generating insights from telematics data to improve operational efficiency.",Data,Manufacturing,https://transportation.trimble.com/
"NVIDIA DRIVE Sim","A simulation platform built on NVIDIA Omniverse for testing and validating autonomous vehicles. It uses generative AI to create diverse and realistic scenarios, sensor models, and environments for robust AV development.",Data,Manufacturing,https://developer.nvidia.com/drive/simulation
"ING Bank (INGo)","INGo, an AI-driven correspondence banking assistant, provides customers with instant information on banking products, facilitates transactions, processes credit card applications, offers foreign exchange rates, and connects to live support when needed.",Customer,Finance,https://www.ing.com.tr/en/ing/digital-banking/ingo
"CBOT.ai (for Banking)","Provides a conversational AI platform, including generative AI capabilities (CBOT GPT, CBOT LLM), for banks to deploy intelligent virtual assistants for customer service, enhancing customer experience and automating interactions.",Customer,Finance,https://www.cbot.ai/industries/banking
"JPMorgan Chase (Enterprise GenAI Toolkit)","Deployed a GenAI toolkit to over 200,000 employees, with more than half using it multiple times a day for various tasks, aiming to democratize AI access and improve operational efficiencies, fraud prevention, and credit decisions.",Employee,Finance,https://www.jpmorganchase.com/technology/artificial-intelligence
"Goldman Sachs","Implemented generative AI tools for its 12,000 coders, reporting significant efficiency gains, estimated around 20%, in software development and related tasks.",Code,Finance,https://www.goldmansachs.com/media-relations/press-releases/
"Klarna","Deployed a generative AI-based customer service agent powered by OpenAI, capable of handling the workload equivalent of 700 human support agents, providing 24/7 assistance across 23 markets with faster resolution times. (Note: Strategy evolving to re-integrate human empathy for complex issues).",Customer,Finance,https://www.klarna.com/us/customer-service/
"Fundwell","Utilizes Google Cloud AI to streamline the funding process for businesses by analyzing financial health data and matching companies with tailored funding opportunities, thereby accelerating access to capital.",Data,Finance,https://www.fundwell.com/
"Vouched","Offers an AI-driven digital identity verification platform for Know Your Customer (KYC) and Anti-Money Laundering (AML) compliance, secure customer onboarding, and fraud mitigation in financial services and healthcare sectors.",Security,Finance,https://www.vouched.id/
"Ric (Insurtech)","A parametric insurance startup using AI and catastrophe modeling to develop and offer coverage for specific, measurable events like rainfall and flood, aiming for quicker and more transparent claims.",Data,Finance,https://www.ric.insure/
"FinQuery (formerly LeaseQuery)","Fintech company leveraging Gemini for Google Workspace to enhance team collaboration, automate email drafts, and assist in project management for its lease accounting software solutions.",Employee,Finance,https://finquery.com/
"ATB Financial","Deployed Google Workspace with Gemini to its 5,000+ team members to automate routine tasks, enable quick information access, and improve collaboration, while ensuring data security for the Canadian financial institution.",Employee,Finance,https://www.atb.com/company/news/
"Discover Financial Services","Deployed GenAI assistants for both customers (e.g., query resolution, personalized offers) and employees (e.g., internal knowledge search, task automation) to improve service delivery and internal workflows.",Customer,Finance,https://investor.discover.com/news-and-events/press-releases/
"BNP Paribas (with Mistral AI)","Leveraging Mistral AI models across global markets, sales operations, and customer support functions to enhance decision-making, personalize client interactions, and improve operational efficiency.",Data,Finance,https://group.bnpparibas/en/news
"AXA (with Mistral AI)","Empowering its 140,000+ employees with secure AI capabilities from Mistral AI for text generation, document analysis, and summarization to improve productivity and internal knowledge sharing.",Employee,Finance,https://www.axa.com/en/newsroom
"Standard Chartered (with Fortanix)","Early adopter of Fortanix Armet AI, built on Intel Confidential Computing, to securely build custom GenAI applications, mitigating data leakage risks and ensuring compliance for sensitive financial data.",Security,Finance,https://www.sc.com/en/media/press-releases/
"S&P Global","Partnering with Accenture to enable customers and employees to harness generative AI for enhanced data analysis, insight generation from financial datasets, and streamlining research workflows.",Data,Finance,https://www.spglobal.com/en/news-insights/press-releases
"American Express","Leveraging NVIDIA DGX and TensorRT technologies to power an ultra-low-latency system for detecting fraud in credit card transactions, using AI to analyze patterns and identify suspicious activities.",Security,Finance,https://about.americanexpress.com/newsroom/press-releases/default.aspx
"Stripe","Integrating generative AI to help businesses optimize their online checkout experiences, generate product descriptions, and provide AI-powered support for merchants using its payment platform.",Customer,Finance,https://stripe.com/newsroom
"Square (Block)","Leveraging generative AI to provide sellers with tools for creating marketing campaigns, analyzing sales data for insights, and offering AI-powered customer support features within its ecosystem.",Creative,Finance,https://squareup.com/us/en/press
"Vanguard","Partnering with Writer.com to use its full-stack generative AI platform for boosting productivity by combining employee expertise with AI for content creation and other tasks.",Employee,Finance,https://pressroom.vanguard.com/news/
"Brex","Financial technology company offering business credit cards and cash management accounts, using AI for underwriting, expense management automation, and providing financial insights to startups and growing businesses.",Data,Finance,https://www.brex.com/journal
"Mayo Clinic (Digital Pathology)","Collaborating with NVIDIA and Aignostics to advance digital pathology, using AI models to analyze large datasets of pathology images for improved disease detection and prediction.",Data,Healthcare,https://newsnetwork.mayoclinic.org/discussion/mayo-clinic-launches-mayo-clinic-digital-pathology-to-modernize-pathology-speed-medical-breakthroughs/
"Genial Care","Provides a platform using generative AI (including Google Vertex AI) for personalized autism care. The system monitors therapy sessions with children and families, synthesizes session records, improves record quality, tracks each child's progress, and shares this information with providers and families via an app.",Data,Healthcare,https://www.genialcare.com.br/
"Hippocratic AI","Developing safety-focused Large Language Models (LLMs) specifically for healthcare, creating generative AI healthcare agents designed to improve healthcare accessibility and outcomes by providing deep healthcare expertise.",Customer,Healthcare,https://www.hippocraticai.com/
"Recursion Pharmaceuticals","An AI-enabled drug discovery and development company using its Recursion OS platform, which integrates physical experimentation with in silico analysis on 65 petabytes of proprietary biological and chemical data, powered by its BioHive-2 supercomputer (built with NVIDIA).",Data,Healthcare,https://www.recursion.com/
"RxRx.ai (by Recursion)","A hub for Recursion's public datasets, tools (like MapApp™ for exploring biological/chemical relationships), and research using data generated from the Recursion OS, aimed at advancing machine learning research in drug discovery.",Data,Healthcare,https://www.rxrx.ai/
"SOPHiA GENETICS","Offers the SOPHiA DDM™ platform, an AI-driven, cloud-powered system that analyzes multimodal health data (genomics, radiomics) to help clinicians generate real-time, actionable insights for patients with cancer and rare disorders.",Data,Healthcare,https://www.sophiagenetics.com/
"Suki AI","Provides Suki Assistant, an AI voice solution for healthcare that ambiently listens to patient-clinician conversations to automatically generate clinical documentation, recommend codes, stage prescription orders, and answer clinical questions, integrating with EHRs and using Google Cloud Vertex AI.",Employee,Healthcare,https://www.suki.ai/
"Rad AI","Offers Rad AI Reporting, a generative AI software for radiology that creates comprehensive and accurate reports from dictated findings, reducing dictation times by up to 50% and words by up to 90%, and automatically inserting consensus guideline recommendations.",Employee,Healthcare,https://www.radai.com/
"PathAI","Develops AI-powered pathology tools to advance drug and diagnostic development. Its AISight™ digital pathology image management system is a cloud-native workflow solution for laboratories and research centers.",Data,Healthcare,https://www.pathai.com/
"Pfizer","Leveraging AWS GenAI tools (Anthropic's Claude 2.1 via Amazon Bedrock) for accelerated drug development, enabling natural language search across vast research datasets (cutting search time by 80%). Also uses Amazon SageMaker and Lookout for AI-driven manufacturing anomaly detection.",Data,Healthcare,https://www.pfizer.com/science/research-development/artificial-intelligence
"Roche (Diagnostics)","Received FDA breakthrough designation for Ventana TROP2 RxDx Device, an AI-powered computational pathology system for non-small cell lung cancer, combining immunohistochemistry with AI analysis of whole-slide images using AstraZeneca's QCS algorithm.",Data,Healthcare,https://diagnostics.roche.com/global/en/products/instruments/ventana-dp-200-slide-scanner.html
"Roche (Gene Therapy)","Partnering with Dyno Therapeutics to apply AI to the design and optimization of AAV (Adeno-Associated Virus) capsids for next-generation gene therapies.",Creative,Healthcare,https://www.roche.com/research_and_development/partnering/areas-of-interest/gene-therapy
"GE HealthCare (Autonomous Imaging)","Collaborating with NVIDIA to develop AI-driven autonomous X-ray and ultrasound systems, using the NVIDIA Isaac for Healthcare platform for simulation, training, and validation of autonomous imaging capabilities.",Data,Healthcare,https://www.gehealthcare.com/insights/article/ge-healthcare-and-nvidia-reimagine-diagnostic-imaging
"GE HealthCare (Foundation Model)","Developed SonoSAMTrack, a healthcare-specific research foundation model trained on ~200,000 image-mask pairs for image segmentation, using NVIDIA technology.",Data,Healthcare,https://www.gehealthcare.com/products/ultrasound/ai-software
"Amgen","Utilizing NVIDIA BioNeMo and DGX Cloud to build and train large language models for medical research and generative AI models for designing small molecules in drug discovery.",Data,Healthcare,https://www.amgen.com/newsroom
"Well Health Technologies (WELL AI Inbox Admin)","WELL AI Inbox Admin is an AI-powered solution for streamlining clinic inbox management by automating the handling of e-faxes and documents, extracting patient information, and routing it to provider inboxes.",Employee,Healthcare,https://well.company/well-ai-inbox-admin/
"Infinitus Systems","Provides voice AI agents and copilots to automate complex healthcare calls, including benefit verification with payors, prior authorization processes, patient welcome calls, medication adherence check-ins, and provider directory confirmations.",Customer,Healthcare,https://www.infinitus.ai/
